{
  "$schema": "https://jdhart81.github.io/viridis-canon/schemas/function-v1.json",
  "schema_version": 1,
  "id": "restoration",
  "kind": "decision_kernel",
  "name": "Restoration — nucleation planting design (critical cluster size n* + go/no-go)",
  "version": "0.2.0",
  "summary": "Gives the smallest planted cluster that the nucleation model says will grow rather than dissolve (n* = (2aσ/(3Δμ))³), the barrier height, and a go/no-go for a planned cluster size.",
  "line": "Restoration",
  "decision_family": "restoration-design",
  "tier": "admitted",
  "state": "READY",
  "reconciliation": null,
  "blocked": null,
  "doi": "10.5281/zenodo.20982979",
  "lean": {
    "module": "ForestNucleation",
    "sources": [
      {
        "path": "series/ForestNucleation.lean",
        "sha256": "667a826a2e5befac67964b69670435362de2d3d792e163807c3bb7c2aec28132"
      }
    ],
    "theorems": [
      "critical_nucleus",
      "barrier_half_identity",
      "FNT_nonvacuous"
    ],
    "verification_provider": "COMPARATOR_CLOUD",
    "verification_receipt_id": "run-061-fnt"
  },
  "inputs": [
    {
      "name": "sigma",
      "required": true,
      "exclusiveMinimum": 0,
      "type": "number",
      "unit": "model edge-cost units",
      "help": "Edge cost σ — how strongly the cluster boundary is penalised (hostile edges, competition, browse). Must be positive; justify it for the site."
    },
    {
      "name": "delta_mu",
      "required": true,
      "exclusiveMinimum": 0,
      "type": "number",
      "unit": "model suitability units",
      "help": "Site suitability Δμ — per-tree driving force favouring establishment over loss. Must be positive."
    },
    {
      "name": "shape_factor",
      "required": false,
      "exclusiveMinimum": 0,
      "type": "number",
      "unit": "dimensionless",
      "help": "Shape factor a of the cluster boundary (default 1)."
    },
    {
      "name": "cluster_size",
      "required": false,
      "exclusiveMinimum": 0,
      "type": "number",
      "unit": "trees",
      "help": "Planned cluster size. If given, the result says GO when it reaches n*, NO_GO when it does not."
    }
  ],
  "outputs": [
    {
      "name": "critical_radius_r_star",
      "unit": "cube root of trees"
    },
    {
      "name": "critical_nucleus_n_star",
      "unit": "trees"
    },
    {
      "name": "barrier_height",
      "unit": "model energy units"
    },
    {
      "name": "edge_to_suitability_ratio",
      "unit": "dimensionless (convenience only, no cut-offs)"
    },
    {
      "name": "cluster_size",
      "unit": "trees"
    },
    {
      "name": "cluster_reaches_n_star",
      "unit": "bool"
    },
    {
      "name": "go_no_go",
      "unit": "GO|NO_GO"
    }
  ],
  "hypotheses": [
    {
      "id": "edge_cost_positive",
      "statement": "The edge cost σ is positive.",
      "check": "sigma > 0"
    },
    {
      "id": "drive_positive",
      "statement": "The site suitability Δμ is positive.",
      "check": "delta_mu > 0"
    },
    {
      "id": "shape_positive",
      "statement": "The shape factor a is positive when supplied.",
      "check": "shape_factor is None or shape_factor > 0"
    }
  ],
  "example": {
    "inputs": {
      "sigma": 1.5,
      "delta_mu": 1,
      "cluster_size": 2
    },
    "expected_outputs": {
      "critical_radius_r_star": 1,
      "critical_nucleus_n_star": 1,
      "barrier_height": 0.5,
      "edge_to_suitability_ratio": 1.5,
      "cluster_size": 2,
      "cluster_reaches_n_star": true,
      "go_no_go": "GO"
    }
  },
  "scope": "Deterministic theorem-backed computation; empirical input validity is external.",
  "boundary": "Model outputs do not establish field suitability, seed availability, land rights, permits, or ecological success. The result is conditional on the supplied inputs; it does not establish empirical validity, Viridis review, certification, a credit, or a registry determination.",
  "empirical_validation": "NOT_VALIDATED",
  "runner": "runner.py",
  "provenance": {
    "migrated_from": "viridis-conservation-app@398b177",
    "warrant_verdict": "ADMITTED",
    "doi_state": "READY"
  }
}
