{
  "$schema": "https://jdhart81.github.io/viridis-canon/schemas/function-v1.json",
  "schema_version": 1,
  "id": "ssc-relevance-chain-identity",
  "kind": "theorem_function",
  "name": "The Sufficient Sanitization Certificate: Task Information, Data Minimization, and an Ideal Erasure Gap",
  "version": "0.1.0",
  "summary": "For finite X,Y and deterministic S=f(X), I(Y;X)=I(Y;S)+I(Y;X|S).",
  "decision_family": null,
  "tier": "reference",
  "state": "READY",
  "reconciliation": null,
  "blocked": null,
  "doi": "10.5281/zenodo.22236775",
  "lean": {
    "module": "Viridis.Applications.SufficientSanitization",
    "sources": [
      {
        "path": "series/SSC/ViridisRun135.lean",
        "sha256": "e95ad53230883a723f5e3f0cc1d744e329ff5a36e91635f7f67eaf3703d5b21c"
      }
    ],
    "theorems": [
      "relevance_chain_identity"
    ],
    "verification_provider": "COMPARATOR_CLOUD",
    "verification_receipt_id": "Run-135-SufficientSanitization-Comparator-attempt-1"
  },
  "inputs": [],
  "outputs": [],
  "hypotheses": [],
  "example": null,
  "scope": "Theorem function: the Lean hypotheses and conclusion restated as checks over supplied real values.",
  "boundary": "Conditional mathematics about the supplied values only; not empirical validity, a real-world magnitude, Viridis review, certification, a credit, or a registry determination.",
  "empirical_validation": "NOT_VALIDATED",
  "runner": null,
  "provenance": {
    "scaffolded_by": "tools/scaffold_function.py",
    "run_id": "Run-135",
    "theorem_source": "PAPER_PACKAGE_MANIFEST.json#claim_inventory/C1",
    "certificate_sha256": "ea2f42c2d4022b7ad78b7778e41141375955020953ce467d1c98a30c3255553b",
    "catalog_title": "Viridis Run135",
    "name_source": "2026-09-01.json#bundles/SSC/title",
    "summary_source": "PAPER_PACKAGE_MANIFEST.json#claim_inventory/C1",
    "publication_date": "2026-09-01"
  }
}
