{
  "$schema": "https://jdhart81.github.io/viridis-canon/schemas/function-v1.json",
  "schema_version": 1,
  "id": "afforestation",
  "kind": "decision_kernel",
  "name": "Afforestation — seeding efficiency and the 8× edge-hostility lever",
  "version": "0.2.0",
  "summary": "Gives seeding efficiency e = C·(3Δμ/(2aσ))³ (established canopy per seed), the critical nucleus and barrier, and the proven lever: halving edge hostility σ multiplies efficiency by exactly 8.",
  "line": "Restoration",
  "decision_family": "restoration-design",
  "tier": "admitted",
  "state": "READY",
  "reconciliation": null,
  "blocked": null,
  "doi": "10.5281/zenodo.21168224",
  "lean": {
    "module": "AfforestationStewardship",
    "sources": [
      {
        "path": "series/AfforestationStewardship.lean",
        "sha256": "3ebe33bfd6bd74124e87b5d7e73448db58e1459207fd6ff5c00a90fc3ac9526f"
      }
    ],
    "theorems": [
      "establishment_efficiency_cubic_in_drive_over_tension",
      "site_prep_halving_sigma_eightfolds_efficiency",
      "homogeneous_limit_recovers_fnt"
    ],
    "verification_provider": "COMPARATOR_CLOUD",
    "verification_receipt_id": "ast-sower"
  },
  "inputs": [
    {
      "name": "sigma",
      "required": true,
      "exclusiveMinimum": 0,
      "type": "number",
      "unit": "model edge-cost units",
      "help": "Edge hostility σ — surface-tension-like penalty on establishing edges (site prep such as nurse plants or mulch lowers it). Positive."
    },
    {
      "name": "delta_mu",
      "required": true,
      "exclusiveMinimum": 0,
      "type": "number",
      "unit": "model suitability units",
      "help": "Site suitability Δμ — ecological drive favouring establishment. Positive."
    },
    {
      "name": "shape_factor",
      "required": false,
      "exclusiveMinimum": 0,
      "type": "number",
      "unit": "dimensionless",
      "help": "Shape factor a (default 1)."
    },
    {
      "name": "establishment_constant",
      "required": false,
      "exclusiveMinimum": 0,
      "type": "number",
      "unit": "canopy per seed (scale)",
      "help": "Establishment constant C that scales efficiency (default 1)."
    }
  ],
  "outputs": [
    {
      "name": "critical_nucleus_n_star",
      "unit": "trees"
    },
    {
      "name": "barrier_height",
      "unit": "model energy units"
    },
    {
      "name": "seeding_efficiency",
      "unit": "established canopy per seed (scaled by C)"
    },
    {
      "name": "efficiency_if_edge_hostility_halved",
      "unit": "established canopy per seed (scaled by C)"
    }
  ],
  "hypotheses": [
    {
      "id": "edge_hostility_positive",
      "statement": "The edge hostility σ is positive.",
      "check": "sigma > 0"
    },
    {
      "id": "drive_positive",
      "statement": "The site suitability Δμ is positive.",
      "check": "delta_mu > 0"
    },
    {
      "id": "shape_positive",
      "statement": "The shape factor a is positive when supplied.",
      "check": "shape_factor is None or shape_factor > 0"
    },
    {
      "id": "constant_positive",
      "statement": "The establishment constant C is positive when supplied.",
      "check": "establishment_constant is None or establishment_constant > 0"
    }
  ],
  "example": {
    "inputs": {
      "sigma": 1,
      "delta_mu": 1
    },
    "expected_outputs": {
      "critical_nucleus_n_star": 0.296296296,
      "barrier_height": 0.148148148,
      "seeding_efficiency": 3.375,
      "efficiency_if_edge_hostility_halved": 27
    }
  },
  "scope": "Deterministic theorem-backed computation; empirical input validity is external.",
  "boundary": "Model outputs do not establish field suitability, seed availability, land rights, permits, or ecological success. The result is conditional on the supplied inputs; it does not establish empirical validity, Viridis review, certification, a credit, or a registry determination.",
  "empirical_validation": "NOT_VALIDATED",
  "runner": "runner.py",
  "provenance": {
    "migrated_from": "viridis-conservation-app@398b177",
    "warrant_verdict": "ADMITTED",
    "doi_state": "READY"
  }
}
